code,couse_ID,timestamp,content,text
cs1001.1.0,cs1001,2019-03-27,father.jpg,"Gas beyond myself necessary I record. Toward story four point.
American open have personal. Able trade chair kind."
cs1002.1.0,cs1002,2017-06-03,investment.txt,Old voice cover senior none away cut. Stop thank join type admit yet similar film. Vote pick fast today I more.
cs1012.1.0,cs1012,2023-05-06,paper.jpg,Night trouble say or. They experience partner yeah attention remain. So report if education different.
cs1013.1.0,cs1013,2017-12-06,collection.mp4,Born all young act produce market response. Pay hard bar collection myself note.
cs1021.1.0,cs1021,2022-08-23,be.txt,Education agree likely director where cut floor. Charge line charge. Present former future student effort heavy produce account.
el2001.1.0,el2001,2019-10-06,despite.jpg,Pressure article their beat other company mention. Activity or hundred. Adult quite paper win news magazine talk.
el2002.1.0,el2002,2020-10-04,fine.mp4,"Analysis away wind affect none. Success letter trouble.
Rate message their reality paper discover. Since lawyer growth experience guy. Country ask put natural."
el2002.2.0,el2002,2020-10-04,go.jpg,"Whose above hair. Yard picture short offer. Heart bad situation particularly provide character reveal and.
Film usually summer budget. Along campaign itself pressure."
el2003.1.0,el2003,2021-01-30,year.txt,Analysis amount who cut. Four bar protect fine special whole. More continue night coach feel a.
el2012.1.0,el2012,2018-03-25,quickly.txt,"Edge wind far finally peace. Great author yet with cut among. Deal star himself term hit never real.
Hit language program simply fill cause last. Easy project strong door. Ask certainly car property."
el2012.2.0,el2012,2018-03-25,special.txt,Generation response huge from door coach. Where eight quickly race. Anything away listen hand popular drug.
el2021.1.0,el2021,2018-01-20,ago.jpg,"Light market voice down.
Technology decision own eat. Enjoy situation yeah those size water.
Sound edge better until after. Theory even agency table interesting economic pull."
el2022.1.0,el2022,2022-02-07,eat.txt,Be whose produce charge condition ten although more. More talk keep somebody main according. Across economic room project.
bm3001.1.0,bm3001,2022-09-30,rise.jpg,Yes study mind ability long newspaper. Every call society computer. Address ready young loss affect great. Especially little moment piece.
bm3001.2.0,bm3001,2022-09-30,believe.mp4,Keep above eye evening back. Even while test stage participant push if. Technology to soldier visit.
bm3002.1.0,bm3002,2017-06-06,stand.mp4,Miss with newspaper about skin stand class. Sea could believe air thousand she knowledge. Admit fight wear end wish way identify something.
bm3002.2.0,bm3002,2017-06-06,former.txt,Teacher chair letter you. Attention while pretty chair perhaps wish. Firm popular everything wrong left one positive.
bm3003.1.0,bm3003,2022-06-29,officer.jpg,"Happen avoid account market now throughout. Degree hope him rock final enjoy describe.
Because option hair four movement discuss watch. North build consumer source."
bm3003.2.0,bm3003,2022-07-22,majority.mp4,"Go hard stop effort.
Full level form not. Focus successful deal sense tough early hot. Suggest area job available west cover art."
bm3011.1.0,bm3011,2023-04-24,than.jpg,"Paper budget worker worry itself more. Very drug example account around different page.
Mind range chair. Member catch owner power business."
bm3012.1.0,bm3012,2023-01-06,crime.txt,"Care buy road follow wonder idea either girl.
Only between happen real seven I. Shake myself admit cause nation. Home consider weight inside probably."
bm3012.2.0,bm3012,2023-11-18,voice.jpg,"Sister ready ok should far red. Box instead laugh cut past. Quickly college likely brother develop method.
While international ask cup computer. Prove turn hand agree. Pull property however store."
